{
  "schema_version":"1.0","entity_type":"domain-pack-manifest","pack_id":"content-script","pack_version":"1.0","kernel_min_version":"1.0","license":"pending-local-review",
  "supported_workspace_types":["content-workspace","mixed-workspace"],
  "supported_artifact_types":["research-record","script-variant","content-review"],
  "runtime_capabilities":{"required":["filesystem-read","filesystem-write"],"optional":["model-inference","network-access","parallel-agents"]},
  "stages":[{"stage_id":"brief","canonical_state":"proposed","entry_conditions":["brief-fields-complete"],"exit_conditions":["brief-approved"]},{"stage_id":"outline","canonical_state":"ready","entry_conditions":["brief-approved"],"exit_conditions":["outline-recorded"]},{"stage_id":"draft","canonical_state":"running","entry_conditions":["outline-recorded"],"exit_conditions":["draft-recorded"]},{"stage_id":"variants","canonical_state":"review","entry_conditions":["draft-recorded"],"exit_conditions":["variants-preserved"]},{"stage_id":"fact-check-edit","canonical_state":"validation","entry_conditions":["variants-preserved"],"exit_conditions":["review-passed"]},{"stage_id":"approval","canonical_state":"awaiting_approval","entry_conditions":["review-passed"],"exit_conditions":["creation-approved"]}],
  "role_templates":[
    {"role_id":"content-research","role_contract_version":"1.0","mission":"Collect approved sources and record claim support.","permissions":["read:plan","read:output-contract","write:proposal"],"owns":["content:research"],"forbids":["private:source","external:release"],"capabilities":["source-tracing"],"input_contract_refs":["content-brief@1.0","content-output-contract@1.0"],"output_contract_refs":["content-variant@1.0","content-review@1.0","evidence@1.0"],"artifact_obligations":[{"kind":"artifact","contract_ref":"artifact@1.0","required":true}],"evidence_obligations":[{"kind":"evidence","contract_ref":"evidence@1.0","required":true}],"verification":{"methods":["manual","static"],"independent":false,"evidence_required":true},"stop_conditions":["missing-approval","missing-evidence","ownership-conflict"],"dependencies":[],"concurrency_boundaries":{"shared":["plan","output-contract"],"exclusive":["content:research"]},"merge_group":"research"},
    {"role_id":"content-planning","role_contract_version":"1.0","mission":"Turn a brief into an outline and validator-ready plan.","permissions":["read:plan","read:output-contract","write:proposal"],"owns":["content:outline"],"forbids":["private:source","external:release"],"capabilities":["content-planning"],"input_contract_refs":["content-brief@1.0","content-output-contract@1.0"],"output_contract_refs":["content-variant@1.0","content-review@1.0","evidence@1.0"],"artifact_obligations":[{"kind":"artifact","contract_ref":"artifact@1.0","required":true}],"evidence_obligations":[{"kind":"evidence","contract_ref":"evidence@1.0","required":true}],"verification":{"methods":["manual","static"],"independent":false,"evidence_required":true},"stop_conditions":["missing-approval","missing-evidence","ownership-conflict"],"dependencies":["content-research"],"concurrency_boundaries":{"shared":["plan","output-contract"],"exclusive":["content:outline"]},"merge_group":"planning"},
    {"role_id":"content-writing","role_contract_version":"1.0","mission":"Create bounded drafts and preserve all approved variants.","permissions":["read:plan","read:output-contract","write:proposal"],"owns":["content:draft","content:variants"],"forbids":["unsupported-claims","external:release"],"capabilities":["writing","variants"],"input_contract_refs":["content-brief@1.0","content-output-contract@1.0"],"output_contract_refs":["content-variant@1.0","content-review@1.0","evidence@1.0"],"artifact_obligations":[{"kind":"artifact","contract_ref":"artifact@1.0","required":true}],"evidence_obligations":[{"kind":"evidence","contract_ref":"evidence@1.0","required":true}],"verification":{"methods":["manual","static"],"independent":false,"evidence_required":true},"stop_conditions":["missing-approval","missing-evidence","ownership-conflict"],"dependencies":["content-planning"],"concurrency_boundaries":{"shared":["plan","output-contract"],"exclusive":["content:draft","content:variants"]},"merge_group":"creation"},
    {"role_id":"content-fact-check-edit","role_contract_version":"1.0","mission":"Fact-check claims and edit for contract and platform compliance.","permissions":["read:plan","read:output-contract","write:proposal"],"owns":["content:review"],"forbids":["approval:own-work","external:release"],"capabilities":["fact-check","editing"],"input_contract_refs":["content-brief@1.0","content-output-contract@1.0"],"output_contract_refs":["content-variant@1.0","content-review@1.0","evidence@1.0"],"artifact_obligations":[{"kind":"artifact","contract_ref":"artifact@1.0","required":true}],"evidence_obligations":[{"kind":"evidence","contract_ref":"evidence@1.0","required":true}],"verification":{"methods":["manual","static"],"independent":true,"evidence_required":true},"stop_conditions":["missing-approval","missing-evidence","ownership-conflict"],"dependencies":["content-writing"],"concurrency_boundaries":{"shared":["plan","output-contract"],"exclusive":["content:review"]},"merge_group":"review"},
    {"role_id":"content-compliance","role_contract_version":"1.0","mission":"Record creation approval evidence and release boundary decisions.","permissions":["read:plan","read:output-contract","write:proposal"],"owns":["content:approval","content:governance"],"forbids":["external:release"],"capabilities":["compliance","governance"],"input_contract_refs":["content-brief@1.0","content-output-contract@1.0"],"output_contract_refs":["content-variant@1.0","content-review@1.0","evidence@1.0"],"artifact_obligations":[{"kind":"artifact","contract_ref":"artifact@1.0","required":true}],"evidence_obligations":[{"kind":"evidence","contract_ref":"evidence@1.0","required":true}],"verification":{"methods":["manual","static"],"independent":false,"evidence_required":true},"stop_conditions":["missing-approval","missing-evidence","ownership-conflict"],"dependencies":["content-fact-check-edit"],"concurrency_boundaries":{"shared":["plan","output-contract"],"exclusive":["content:approval","content:governance"]},"merge_group":"governance"}
  ],
  "validators":[{"validator_id":"content-brief-shape","kind":"schema","deterministic":true,"human_gate":false},{"validator_id":"content-claims","kind":"claim-source-tracing","deterministic":true,"human_gate":true},{"validator_id":"content-platform","kind":"platform-and-prohibited","deterministic":true,"human_gate":false}],
  "verification_classes":["static","manual"],"release_approval":{"delivery_scope":"work_product","external_release_scope":"external_release","separate_approval_required":true},"generation_basis":["ownership","risk","verification","concurrency"],"external_tools":[],"models":[],"network":{"allowed":false,"destinations":[]},"credentials":{"required":false,"kinds":[]},"publishing":{"allowed":false,"approval_scope":"external_release"},"publication":{"allowed":false,"approval_scope":"external_release"},"capabilities":{"discovery":["brief","sources"],"execution":["proposal","variant"],"verification":["static","manual"]},"context_routes":[{"route_id":"content-governance","purpose":"approved brief and source governance","owner_role_id":"domain-pack","allowed_sensitivity":["public","internal"]}],
  "compatibility":{"supported_kernel_versions":["1.0"],"supported_pack_versions":["1.0"],"migration_from_pack_versions":[],"migration_strategy":"explicit-versioned-manifest"},
  "deprecation":{"status":"active","deprecated_since":"","removal_version":"","replacement_pack_id":"","policy":"announce replacement and migration path before removal"},
  "fixtures":[{"fixture_id":"content-normal-closure","path":"fixtures/normal-closure.json","scenario_type":"normal-closure","fingerprint":"sha256:6de1c1e862e1cce0475c98912cddc15edc7f84788fd661108f6590c1c6b9c2be"},{"fixture_id":"content-controlled-recovery","path":"fixtures/controlled-recovery.json","scenario_type":"controlled-failure-recovery","fingerprint":"sha256:6ae4a9304e351d242ab790181e1e6cdf7abb1e5255ca7120c68a27fa02cc72ad"}],
  "fingerprint":"sha256:3fef6edf7796cd018258ef5af142cf6d3ca89d31c592185d45bb8765cc0cbb47"
}
